id,name,type,subtype,cost,mana_value,atk,hp,rarity,max_copies_deck,ability,ability_desc,effect,value,no_pack,set,set_number,desc
demon_118,Spark Imp,demon,regalia,1,1,2,1,common,2,haste,Haste — can attack immediately.,,,True,,,Born in a lightning strike. Gone in the next.
demon_119,Storm Hound,demon,regalia,2,1,3,2,common,2,haste_poisonous,Haste. Poisonous — kills any demon it damages.,,,True,,,The thunder carries it. The lightning is its bite.
demon_120,Tempest Knight,demon,regalia,3,1,2,6,common,2,taunt,Taunt — enemies must attack this first.,,,True,,,Stands in the eye of the storm. Unmoved.
demon_121,Thunder Drake,demon,regalia,3,1,5,2,rare,2,haste,Haste — can attack immediately.,,,True,,,Strikes from the clouds before you can react.
demon_122,Stormcaller,demon,regalia,4,1,3,5,rare,2,battlecry_aoe_2,Battlecry: Deal 2 damage to all enemy demons.,,,True,,,"""The storm does not choose its victims. It teaches them."" — Stormcaller IX"
demon_123,Thunder Sovereign,demon,regalia,5,1,6,6,legendary,1,battlecry_damage_player_2,Battlecry: Deal 2 damage to the enemy.,,,True,,,"""He who commands the storm commands all. And I command the storm."" — Thunder Sovereign"
spell_066,Lightning Bolt,spell,,2,1,,,rare,2,,Deal 6 damage. The sky does not warn you.,damage,6,True,,,
spell_067,Chain Lightning,spell,,3,1,,,rare,2,,Deal 2 damage to all enemy demons. The chain never ends.,aoe_enemy,2,True,,,
spell_068,Thunder Ward,spell,,1,1,,,common,2,,Give a friendly demon +3 HP. Hardened by lightning strikes.,buff_hp,3,True,,,
demon_124,Skeleton,demon,neutra,1,1,1,1,common,30,skeleton_horde,Skeleton Horde — no copy limit in your deck.,,,,,,A rookie in the infernal army.
demon_125,Skeleton Soldier,demon,neutra,2,1,2,2,common,30,skeleton_horde,Skeleton Horde — no copy limit in your deck.,,,,,,Frontline of the infernal army.
